30,OPEN,Deploy SkillHarbor to production environment and monitor stability.,,2024-03-18T10:21:18Z
29,OPEN,Plan deployment strategy and set up hosting environment.,,2024-03-18T10:20:27Z
28,OPEN,Prepare documentation and user guides for the platform.,,2024-03-18T10:18:39Z
27,OPEN,Address any bugs, issues, or performance optimizations.,,2024-03-18T10:17:26Z
26,OPEN,Conduct comprehensive testing of all features and functionalities.,,2024-03-18T10:16:11Z
25,OPEN,Test feedback submission, rating, and analytics features.,,2024-03-18T10:14:23Z
24,OPEN,Integrate data visualization tools for presenting insights.,,2024-03-18T10:13:26Z
23,OPEN,Develop analytics dashboard for users to track skill progress.,,2024-03-18T10:12:25Z
22,OPEN,Implement feedback submission and rating system.,,2024-03-18T10:09:32Z
21,OPEN,Design UI for employers to provide feedback and reviews.,,2024-03-18T10:07:25Z
20,OPEN,Test resource access and user tracking features.,,2024-03-18T10:02:44Z
19,OPEN,Implement user tracking for completed courses or materials.,,2024-03-18T10:01:40Z
18,OPEN,Test and debug the skill assessment module.,,2024-03-18T09:59:04Z
17,OPEN,Integrate assessment results into user profiles.,,2024-03-18T09:54:54Z
16,OPEN,Implement frontend components for taking assessments.,,2024-03-18T09:53:20Z
13,OPEN,Develop backend logic for creating assessment quizzes/surveys.,,2024-03-18T09:56:52Z
12,OPEN,Design the user interface for skill assessment.,,2024-03-18T09:56:10Z
11,CLOSED,Enable users to edit and update their profiles.,,2024-03-15T14:03:54Z
10,CLOSED,Develop user login and authentication system.,,2024-03-15T14:03:54Z
9,CLOSED,Create user profile creation form.,,2024-03-15T14:03:53Z
8,CLOSED,Implement email verification for account activation.,,2024-03-15T14:03:53Z
7,CLOSED,Set up user registration functionality,,2024-03-15T14:03:52Z
